hanzi,pinyin,english,thai_current,freq,level
江,jiāng,river,แม่น้ำ,2,5
沉思,chén sī,to contemplate; to ponder,ครุ่นคิด,2,5
沉着,chén zhuó,steady; calm and collected,"ใจเย็น, มั่นคง, สงบเสงี่ยม",2,5
沉重,chén zhòng,heavy; hard,"หนัก, น้ำหนักมาก",2,5
没错,méi cuò,that's right; sure!,ถูกต้องแล้ว,2,4
河流,hé liú,river,แม่น้ำ,2,5
治,zhì,to rule; to govern,"ปกครอง, ปืนปกครอง, ปกครองดูแล",2,5
治愈,zhì yù,to cure; to restore to health,"รักษาให้หาย, หายจากการรักษา, ทำให้หาย",2,6
注视,zhù shì,to look attentively at,"จ้องมอง, มองอย่างมั่นคง, จ้องมองเขาว่า",2,6
流畅,liú chàng,flowing; fluent,"ไหลลื่น, ราบเรียบ, ไม่ติดขัด",2,6
流血,liú xiě,to bleed; to shed blood,"ออกเลือด, เลือดไหลออก, ตกเลือด",2,5
流通,liú tōng,to circulate; to distribute,หมุนเวียน,2,5
浑身,hún shēn,all over; from head to foot,ทั้งตัว,2,5
浮力,fú lì,buoyancy,"แรงลอยตัว, พลังยกตัว, กำลังลอยตัว",2,6
海绵,hǎi mián,zoology sea sponge; esp. dried sea sponge,"ฟองน้ำ, ฟองน้ำสีม่วง, สิ่งที่ซึมซับ",2,6
海面,hǎi miàn,the surface of the sea; ocean surface,"ผิวน้ำทะเล, พื้นผิวทะเล, ผิวทะเล",2,6
涉及,shè jí,to involve,"เกี่ยวข้อง, ศึกษา, เป็นส่วนหนึ่ง",2,6
涨,zhǎng,to rise,สูงขึ้น,2,5
淘汰,táo tài,to wash out,"ล้างออก, คัดออก, ตัดออก",2,5
深度,shēn dù,depth; of a speech etc profundity,ความลึก,2,6
混乱,hùn luàn,confused; chaotic,"ความสับสน, ความยุ่งเหยิง, เนื่องจากความสับสน",2,6
混淆,hùn xiáo,to obscure; to confuse,สับสนหรือทำให้วุ่นวายกัน,2,6
清理,qīng lǐ,to clear up; to tidy up,ทำความสะอาด,2,5
清除,qīng chú,to clear away; to eliminate,"ทำความสะอาด, ลบออก, กำจัด",2,6
温和,wēn hé,mild; gentle,"อ่อนโยน, อ่อน, ท่าทีอ่อน",2,5
温柔,wēn róu,gentle and soft; tender,อ่อนโยนและนุ่มนวล,2,6
温泉,wēn quán,hot spring,น้ำพุร้อน,2,6
游玩,yóu wán,to amuse oneself; to have fun,"เล่น, สนุกสนาน, ท่องเที่ยวเพื่อความสุข",2,4
游览,yóu lǎn,to go sightseeing; to tour,ท่องเที่ยว,2,5
渺小,miǎo xiǎo,minute; tiny,เล็กมาก,2,5
湿度,shī dù,humidity level,"ความชื้น, ระดับความชื้น, ปริมาณความชื้น",2,6
溶解,róng jiě,to dissolve,"ละลาย, ทำให้ละลาย, ละลายหายไป",2,6
滑,huá,slippery; to slide,ลื่น,2,5
滑冰,huá bīng,to skate; skating,สเก็ต,2,5
漏,lòu,to leak; to divulge,"รั่ว, รั่วไหล, ออกไป",2,5
演奏,yǎn zòu,to perform on a musical instrument,บรรเลงดนตรี,2,6
潜力,qián lì,potential; latent capacity,ศักยภาพ,2,5
潮,cháo,tide; damp,น้ำขึ้น,2,5
潮流,cháo liú,tide; current,"กระแสน้ำขึ้นลง, แนวโน้ม, จังหวะเวลา",2,6
火灾,huǒ zāi,serious fire,ไฟไหม้อาคาร,2,6
灭,miè,to extinguish or put out; to go out,"ดับ, ดับไป, ปิดไฟ",2,6
灭亡,miè wáng,to be destroyed; to destroy,"ล่มสลาย, เสื่อมเทพ, ถูกทำลาย",2,6
灾难,zāi nàn,disaster; catastrophe,ภัยพิบัติ,2,6
炎热,yán rè,blistering hot; sizzling hot,ร้อนแรง,2,5
炸药,zhà yào,explosive; blasting agent,วัตถุระเบิด,2,6
烟,yān,cigarette or pipe tobacco; smoke,"บุหรี่, หมอก, มูกไฟ",2,6
热门,rè mén,popular; hot,"เป็นที่นิยม, นิยม, ประเด็นร้อน",2,6
焦点,jiāo diǎn,focal point; focus,"จุดรวมมิติ, จุดมาบรรจบกัน, จุดสนใจ",2,5
焦虑,jiāo lǜ,anxious; worried,"วิตกกังวล, เป็นห่วง, ตื่นใจ",2,5
照明,zhào míng,lighting; illumination,การให้แสง,2,6
熟,shú,ripe; mature,สุก,2,5
燃料,rán liào,fuel,เชื้อเพลิง,2,6
爆炸,bào zhà,explosion; to explode,ระเบิด,2,6
爱心,ài xīn,compassion; kindness,"เมตตา, ความเห็นใจ",2,5
爱惜,ài xī,to cherish; to treasure,ดูแลรักษา,2,5
片面,piàn miàn,unilateral; one-sided,ด้านเดียว,2,5
牙刷,yá shuā,toothbrush,แปรงสีฟัน,2,4
牛仔裤,niú zǎi kù,jeans,กางเกงยีนส์,2,5
牧场,mù chǎng,pasture; grazing land,"ทุ่งหญ้าเลี้ยงสัตว์, สนามเลี้ยงสัตว์",2,6
牵,qiān,to lead along; to pull,"นำเข้า, ลากไป, ลัดลวง",2,6
特征,tè zhēng,characteristic; diagnostic property,"ลักษณะเฉพาะ, สมบัติเฉพาะ, ลักษณ์จำเพาะ",2,6
特性,tè xìng,property; characteristic,"คุณลักษณะ, ลักษณะ, ลักษณะเฉพาะ",2,6
独自,dú zì,alone,คนเดียว,2,5
狭小,xiá xiǎo,narrow,"แคบ, แคบเล็ก, อับแคบ",2,6
猎人,liè rén,hunter,นักล่า,2,5
率,lǜ,rate; ratio,"อัตรา, ความถี่",2,6
现场,xiàn chǎng,the scene; on the spot,สถานที่เกิดเหตุ,2,5
玻璃,bō lí,glass,กระจก,2,5
球员,qiú yuán,ball sports player; team member,นักกีฬา,2,4
理性,lǐ xìng,reason; rationality,"เหตุผล, สติปัญญา",2,6
理智,lǐ zhì,reason; intellect,"เหตุผล, สติ",2,5
生动,shēng dòng,"of descriptions, writing etc vivid; lively","ชีวชีวะ, มีชีวิตชีวา",2,5
用心,yòng xīn,diligent; attentive; with concentration,ตั้งใจ; เอาใจใส่,2,4
电台,diàn tái,transmitter-receiver; broadcasting station,สถานีวิทยุ,2,5
电视机,diàn shì jī,television set,โทรทัศน์,2,5
男士,nán shì,man; gentleman,ชายผู้ใหญ่,2,6
畅销,chàng xiāo,to sell well; bestselling,"ขายดี, เป็นสินค้าขายดี",2,6
留学生,liú xué shēng,student studying abroad,นักเรียนแลกเปลี่ยน,2,3
留言,liú yán,to leave a message; message,"ปล่อยข้อความ, แสดงความคิดเห็น",2,5
番茄,fān qié,tomato,มะเขือเทศ,2,6
疲惫,pí bèi,beaten; exhausted,"เหนื่อยล้า, อ่อนเพลีย",2,6
痕迹,hén jì,vestige; mark,"ร่องรอย, เครื่องหมาย",2,5
痛,tòng,ache; pain,ปวด,2,6
登机,dēng jī,to board a plane,ขึ้นเครื่องบิน,2,4
登记,dēng jì,to register,ลงทะเบียน,2,5
皆,jiē,all; each and every,"ทั้งหมด, ทุกคน",2,6
皇宫,huáng gōng,imperial palace,พระราชวัง,2,6
皮鞋,pí xié,leather shoes,รองเท้าหนัง,2,3
盛,shèng,flourishing; abundant; grand,"เจริญรุ่งเรือง, อุดมสมบูรณ์",2,5
盲目,máng mù,unthinking,"บอด, โดยไม่คิด",2,6
直至,zhí zhì,lasting until; up till,"จนกระทั่ง, ถึง",2,6
相声,xiàng shēng,comic dialogue; sketch,การแสดงตลกคู่ (เซียงเซิง),2,5
相差,xiāng chà,to differ,แตกต่างจากกัน,2,6
相当,xiāng dāng,equivalent to; appropriate,เทียบเท่า,2,5
看似,kàn shì,to look as if; to seem,ดูเหมือน,2,5
看出,kàn chū,to make out; to see,มองเห็น,2,4
眼界,yǎn jiè,field of vision; outlook; horizon,"แนวมองของตา, ความเข้าใจ",2,6
矮小,ǎi xiǎo,short and small; low and small,"เตี้ย, เล็กน้อย",2,6
砍,kǎn,to chop; to cut down,"ฟัน, สับ",2,5
研发,yán fā,research and development; to develop,วิจัยและพัฒนา,2,5
破产,pò chǎn,to go bankrupt; to become impoverished,ล้มละลาย,2,5
破裂,pò liè,to burst; to rupture,ฉีกขาด,2,6
碰到,pèng dào,to come across; to run into,เจอ,2,5
碳,tàn,carbon,คาร์บอน,2,6
磨难,mó nàn,a torment; a trial,"ความยากลำบาก, การทดสอบ",2,6
示意,shì yì,to hint; to indicate,เบาะแส,2,5
礼,lǐ,gift; courtesy,ของขวัญ,2,4
祖先,zǔ xiān,ancestors; forebears,บรรพบุรุษ,2,5
祝福,zhù fú,blessings; to wish someone well,ความเป็นสิริมงคล,2,5
神经,shén jīng,nerve; mental state,เส้นประสาท,2,5
福利,fú lì,material benefit; benefit in kind,สวัสดิการ,2,5
离婚,lí hūn,to divorce,หย่า,2,5
种种,zhǒng zhǒng,all kinds of,"หลายชนิด, ประเภทต่างๆ",2,5
租金,zū jīn,rent,ค่าเช่า,2,4
秩序,zhì xù,order; orderliness,"ระเบียบ, ลำดับ",2,5
积,jī,to amass; to accumulate,"สะสม, เก็บ",2,5
积蓄,jī xù,to save; to put aside,"เก็บสะสม, ออม",2,6
稀少,xī shǎo,sparse; rare,หาได้ยาก,2,5
稍,shāo,somewhat; a little,เล็กน้อย,2,4
空隙,kòng xì,crack; gap between two objects,ช่องว่างระหว่างวัตถุ,2,6
穿过,chuān guò,to pass through,ผ่านไป,2,5
窝,wō,nest; hollow,รัง,2,5
立场,lì chǎng,position; standpoint,"ตำแหน่ง, จุดยืน",2,6
站立,zhàn lì,to stand; standing,ยืนตัวตั้ง,2,5
童话,tóng huà,children's fairy tales,"นิทานเด็ก, นิทานพ้อ",2,6
端,duān,tip; end,"ปลาย, ขอบ",2,6
端午节,duān wǔ jié,Dragon Boat Festival,เทศกาลเรือมังกร,2,5
答,dá,to answer; to reply,ตอบ,2,5
筛选,shāi xuǎn,to filter,"กลั่นกรอง, เลือก",2,6
简历,jiǎn lì,curriculum vitae; résumé,เอกสารประวัติ,2,5
简洁,jiǎn jié,concise; succinct,"สั้นกระชับ, กระชับ",2,6
算是,suàn shì,considered to be; at last,ถือว่า,2,4
箭,jiàn,arrow,ลูกศร,2,5
粒,lì,grain; granule,"เม็ด, ละเม็ด",2,6
精,jīng,essence; extract,"สาระสำคัญ, สกัด",2,6
精品,jīng pǐn,quality goods; premium product,"สินค้าคุณภาพ, ผลิตภัณฑ์ระดับพรีเมียม",2,6
素材,sù cái,source material,"วัสดุดิบ, ข้อมูลต้นฉบับ",2,6
紧密,jǐn mì,inseparably close,ยึดติดกันแน่นแฟ้น,2,5
紧急,jǐn jí,urgent; emergency,เร่งด่วน,2,5
紧紧,jǐn jǐn,closely; tightly,"แน่นหนา, มิดชิด",2,5
繁忙,fán máng,busy; bustling,"ยุ่งเหลือเฟือ, หนาแน่น",2,6
繁荣,fán róng,prosperous; booming,เจริญรุ่งเรือง,2,5
红茶,hóng chá,black tea,ชาดำ,2,3
约束,yuē shù,to restrict; to limit to,"จำกัด, บังคับ",2,6
纪念,jì niàn,to commemorate; to honor the memory of,ระลึกถึง,2,5
纯,chún,pure; simple,"บริสุทธิ์, เรียบง่าย",2,6
纯洁,chún jié,pure; clean and honest,"บริสุทธิ์, สะอาด",2,6
组合,zǔ hé,to assemble; to combine,"รวมเข้าด้วยกัน, การรวมกัน",2,6
细微,xì wēi,tiny; minute,ละเอียดอ่อน,2,6
细心,xì xīn,meticulous; careful,ระมัดระวัง,2,5
细腻,xì nì,of skin etc smooth; satiny,"ละเอียดอ่อน, ประณีต",2,6
终生,zhōng shēng,throughout one's life; lifetime,"ตลอดชีวิต, ทั้งชีวิต",2,6
经商,jīng shāng,to trade; to carry out commercial activities,ทำการค้า,2,5
结冰,jié bīng,to freeze,เยือกแข็ง,2,5
结合,jié hé,to combine; to link,รวมกัน,2,5
绝,jué,to cut short; extinct,"ขาด, สูญหาย",2,6
统计,tǒng jì,statistics; to count,"สถิติ, นับหลาย",2,5
继,jì,to continue; to follow after,"ทำต่อ, ติดตามหลัง",2,6
续,xù,to continue; to replenish,ดำเนินต่อไป,2,6
维护,wéi hù,to defend; to safeguard,ปกป้อง,2,5
缘故,yuán gù,reason; cause,เหตุผล,2,5
缩小,suō xiǎo,to reduce; to decrease,ลดขนาด,2,5
缩短,suō duǎn,to shorten; to reduce,ลดให้สั้นลง,2,6
罚款,fá kuǎn,to fine; penalty,"ปรับเงิน, โทษเงิน",2,6
美容,měi róng,beauty treatment,สมุนไพรความสวย,2,5
美满,měi mǎn,happy; blissful,"สุขสม, พอใจ",2,6
群体,qún tǐ,community; colony,กลุ่มสัตว์,2,5
翻,fān,to turn over; to flip over,พลิก,2,5
老实,lǎo shí,honest; sincere,"สัจจะ, ตรงไปตรงมา",2,5
考量,kǎo liáng,to consider carefully,พิจารณาอย่างรอบคอบ,2,6
考验,kǎo yàn,to test; to put to the test,"ทดสอบ, ทำให้สัมผัสการทดสอบ",2,5
耍,shuǎ,to play,เล่น,2,5
职责,zhí zé,duty; responsibility,หน้าที่,2,6
聘用,pìn yòng,to employ; to hire,ว่าจ้าง,2,5
聚集,jù jí,to assemble; to gather,"รวมตัว, ชุมนุม",2,5
肉,ròu,meat; flesh,เนื้อสัตว์,2,2
胃口,wèi kǒu,appetite; liking,"ความอยากอาหาร, รสนิยม",2,5
胆子,dǎn zi,courage; nerve,"ความกล้า, ใจกล้า",2,5
胜,shèng,victory; success,"ชัยชนะ, ความสำเร็จ",2,6
胳膊,gē bó,arm,แขน,2,4
脚步,jiǎo bù,footstep; step,การเดินเท้า,2,5
脱身,tuō shēn,to get away; to escape,หนีออก,2,6
腐蚀,fǔ shí,corrosion; to corrode,"ผุกร่อน, เน่าเสีย",2,6
膜,mó,membrane; film,เยื่อบาง,2,5
自从,zì cóng,since; ever since,ตั้งแต่,2,5
自信心,zì xìn xīn,self-confidence,ความเชื่อมั่นในตนเอง,2,6
自学,zì xué,self-study; to study on one's own,เรียนด้วยตนเอง,2,6
自私,zì sī,selfish; selfishness,เห็นแก่ตัว,2,5
致富,zhì fù,to become rich,ให้รวยมั่งคั่ง,2,5
舌头,shé tou,tongue,ลิ้น,2,6
航运,háng yùn,shipping; transport,การขนส่งทางเรือ,2,6
良性,liáng xìng,positive; leading to good consequences,"เชิงบวก, ดี",2,6
艰辛,jiān xīn,hardships; arduous,ความยากลำบาก,2,6
色,sè,color; look,"สี, รูปลักษณ์",2,3
芬芳,fēn fāng,perfume; fragrant,หอม,2,5
芭蕾,bā lěi,ballet,บัลเล่ต์,2,6
花园,huā yuán,garden; park,สวนดอกไม้,2,3
花样,huā yàng,pattern; way of doing something,"รูปแบบ, วิธีการ",2,6
花纹,huā wén,decorative design,ลวดลายตกแต่ง,2,6
苗条,miáo tiáo,of a woman slim; slender,สูงผอม,2,5
