hanzi,pinyin,english,thai_current,freq,level,thai_proposed,note
奇迹,qí jì,miracle; wonder,"ปาฏิหาริย์, สิ่งมหัศจรรย์",6,5,"ปาฏิหาริย์, สิ่งมหัศจรรย์",
女子,nǚ zǐ,woman; female,"ผู้หญิง, หญิง",6,6,"ผู้หญิง, หญิง",
妹妹,mèi mèi,younger sister; young woman,น้องสาว,6,2,น้องสาว,"EN-GLOSS-BUG: 妹妹 = younger sister; 'young woman' is a colloquial extension, not a core sense. Thai keeps the real sense."
委屈,wěi qū,to feel wronged; hard done by,รู้สึกน้อยใจ,6,5,รู้สึกน้อยใจ,
客气,kè qì,polite; courteous,เกรงใจ; สุภาพ; ไม่เป็นไร,6,1,สุภาพ; เกรงใจ,"Trimmed to lead+one per style guide; dropped ไม่เป็นไร (the 别客气 'you're welcome' usage, out of the polite/courteous gloss)."
客观,kè guān,objective; impartial,"ภววิสัย, เป็นกลาง",6,5,"ภววิสัย, เป็นกลาง",
寒假,hán jià,winter vacation,ปิดเทอมฤดูหนาว,6,4,ปิดเทอมฤดูหนาว,
对待,duì dài,to treat; treatment,"ปฏิบัติต่อ, การรักษา",6,5,ปฏิบัติต่อ; การปฏิบัติ,Current การรักษา wrongly implies medical treatment; 对待 = treat/behave toward (verb) + manner of treatment (noun).
寿命,shòu mìng,life span; life expectancy,"อายุขัย, อายุการใช้งาน",6,5,"อายุขัย, อายุการใช้งาน",
尝试,cháng shì,to try,"ลอง, พยายาม",6,5,"ลอง, พยายาม",
居然,jū rán,unexpectedly; to one's surprise,กลับ (อย่างคาดไม่ถึง),6,5,กลับ (อย่างคาดไม่ถึง),
工具,gōng jù,tool; instrument,"เครื่องมือ, อุปกรณ์",6,4,"เครื่องมือ, อุปกรณ์",
常用,cháng yòng,in common usage,"ใช้บ่อย, ใช้กันทั่วไป",6,5,"ใช้บ่อย, ใช้กันทั่วไป",
平静,píng jìng,calm; tranquil,"สงบ, เงียบสงบ",6,5,"สงบ, เงียบสงบ",
年代,nián dài,a decade of a century; age,"ยุค, ช่วงเวลา",6,5,"ยุค, ช่วงเวลา",
度过,dù guò,to pass; to spend,"ผ่านไป, ใช้เวลา",6,5,"ผ่านไป, ใช้เวลา",
建议,jiàn yì,to propose; to suggest,เสนอแนะ; ข้อเสนอแนะ,6,4,เสนอแนะ; ข้อเสนอแนะ,
开阔,kāi kuò,wide; open,"กว้างขวาง, เปิดกว้าง",6,6,"กว้างขวาง, เปิดกว้าง",
强壮,qiáng zhuàng,strong; sturdy,แข็งแรง,6,5,แข็งแรง,
待遇,dài yù,treatment; pay,"ค่าตอบแทน, การปฏิบัติ",6,5,การปฏิบัติ; ค่าตอบแทน,Two distinct senses (treatment; pay) -> '; '; reordered to match EN.
必,bì,certainly; must,"ต้อง, แน่นอน",6,4,"ต้อง, แน่นอน",
忽视,hū shì,to neglect,"มองข้าม, ละเลย",6,5,"มองข้าม, ละเลย",
急,jí,urgent; pressing,"รีบ, ด่วน; ร้อนใจ",6,4,"รีบ, ด่วน; ร้อนใจ",
患,huàn,to suffer; to contract,"ป่วยเป็น, เป็น (โรค)",6,6,"ป่วยเป็น, เป็น (โรค)",
想到,xiǎng dào,to think of; to call to mind,"นึกถึง, คิดถึง(ได้)",6,2,"นึกถึง, นึกออก",Replaced คิดถึง (=miss someone) with นึกออก (recall/come to mind).
想象,xiǎng xiàng,to imagine; to envision,"จินตนาการ, นึกภาพ",6,5,"จินตนาการ, นึกภาพ",
感激,gǎn jī,to be grateful; to appreciate,"ซาบซึ้ง, สำนึกในบุญคุณ",6,5,"ซาบซึ้ง, สำนึกในบุญคุณ",
成分,chéng fèn,composition; one's social status,"ส่วนประกอบ, องค์ประกอบ",6,5,ส่วนประกอบ; ภูมิหลังทางชนชั้น,"Added the distinct 'social status' sense the EN lists (社会成分, dated/political = class background)."
成语,chéng yǔ,Chinese set expression,"สำนวนจีน (เฉิงอวี่, มักสี่พยางค์)",6,5,"สำนวนจีน (เฉิงอวี่, มักสี่พยางค์)",
房屋,fáng wū,house; building,"บ้าน, อาคาร",6,5,"บ้าน, อาคาร",
房租,fáng zū,rent for a room or house,ค่าเช่าบ้าน,6,4,ค่าเช่าบ้าน,
手里,shǒu lǐ,in hand; a situation is in someone's hands,"ในมือ, อยู่ในมือ",6,4,"ในมือ, อยู่ในมือ",
扩散,kuò sàn,to spread; to proliferate,"แพร่กระจาย, แพร่ขยาย",6,5,"แพร่กระจาย, แพร่ขยาย",
扫,sǎo,to sweep; to sweep away,ทำความสะอาด,6,5,"กวาด, กวาดล้าง",Current ทำความสะอาด too general; 扫 = sweep (กวาด) / sweep away (กวาดล้าง).
承认,chéng rèn,to admit; to concede,ยอมรับ,6,5,ยอมรับ,
招聘,zhāo pìn,to invite applications for a job; to recruit,"รับสมัคร(งาน), จ้างงาน",6,4,"รับสมัคร(งาน), จ้างงาน",
拿出,ná chū,to take out; to put out,"หยิบออกมา, นำออกมา",6,3,"หยิบออกมา, นำออกมา",
挤,jǐ,to crowd in; to cram in,"แหน่บ, ยัด",6,5,"เบียด, ยัด","Replaced non-standard 'แหน่บ'; 挤 = crowd/squeeze in (เบียด), cram (ยัด)."
推出,tuī chū,to push out; to release,"เปิดตัว, นำออกสู่ตลาด",6,4,"เปิดตัว, นำออกสู่ตลาด",
推荐,tuī jiàn,to recommend,"แนะนำ, เสนอชื่อ",6,5,"แนะนำ, เสนอชื่อ",
提,tí,to carry; to lift,"หิ้ว, ถือ; ยก(ขึ้นมา); เอ่ยถึง",6,4,"หิ้ว, ถือ; ยก(ขึ้นมา)","Trimmed third sense เอ่ยถึง (to mention), out of the carry/lift gloss."
摇,yáo,to shake; to wave,"เขย่า, โบก, ส่าย",6,5,"เขย่า, โบก, ส่าย",
收获,shōu huò,to harvest; to reap,"เก็บเกี่ยว; ผลที่ได้รับ, ผลเก็บเกี่ยว",6,5,"เก็บเกี่ยว; ผลที่ได้รับ, ผลเก็บเกี่ยว",
放到,fàng dào,to place at,"วาง, ใส่",6,3,"วาง, ใส่",
故乡,gù xiāng,home; homeland,บ้านเกิด,6,5,บ้านเกิด,
救,jiù,to save; to assist,"ช่วย, ช่วยเหลือ, ช่วยชีวิต",6,5,"ช่วย, ช่วยเหลือ, ช่วยชีวิต",
教练,jiào liàn,coach; trainer; to coach,"โค้ช, ผู้ฝึกสอน",6,5,"โค้ช, ผู้ฝึกสอน",
断,duàn,to break; to snap,"ขาด, แตก",6,5,"ขาด, หัก",断 = snap/sever (ขาด/หัก); current แตก is shatter (破/碎).
方案,fāng àn,plan; program,"แผนงาน, แผนการ",6,5,"แผนงาน, แผนการ",
无关,wú guān,unrelated; having nothing to do,ไม่เกี่ยวข้อง,6,4,ไม่เกี่ยวข้อง,
无论,wú lùn,no matter what; regardless,ไม่ว่า...ก็ตาม,6,4,ไม่ว่า...ก็ตาม,
时代,shí dài,era; age; times,ยุคสมัย; ยุค,6,5,"ยุคสมัย, ยุค","Variants of one sense -> comma, not '; '."
春天,chūn tiān,spring,ฤดูใบไม้ผลิ,6,3,ฤดูใบไม้ผลิ,
显然,xiǎn rán,clearly; evidently,"เห็นได้ชัด, ชัดเจน",6,5,"เห็นได้ชัด, ชัดเจน",
景,jǐng,scenery; view,"ทิวทัศน์, วิว",6,5,"ทิวทัศน์, วิว",
最佳,zuì jiā,optimum; optimal,"ดีที่สุด, เหมาะสมที่สุด",6,6,"ดีที่สุด, เหมาะสมที่สุด",
最终,zuì zhōng,final; ultimate,"สุดท้าย, ในที่สุด",6,4,"สุดท้าย, ในที่สุด",
有利于,yǒu lì yú,to be advantageous to,"เป็นประโยชน์ต่อ, เอื้อต่อ",6,5,"เป็นประโยชน์ต่อ, เอื้อต่อ",
有益,yǒu yì,useful; beneficial,มีประโยชน์,6,5,มีประโยชน์,
有限,yǒu xiàn,limited; finite,จำกัด,6,4,จำกัด,
本来,běn lái,original; originally,"เดิมที, แต่แรก",6,4,"เดิมที, แต่แรก",
机构,jī gòu,mechanism; structure,"องค์กร, กลไก",6,6,"องค์กร, กลไก","EN-GLOSS-BUG: 机构 most often = 'organization/institution/agency' (องค์กร), which the EN gloss ('mechanism; structure') omits. Thai already carries it."
来自,lái zì,to come from; From,มาจาก,6,4,มาจาก,
极其,jí qí,extremely,"อย่างยิ่ง, สุดๆ",6,4,"อย่างยิ่ง, สุดๆ",
构成,gòu chéng,to constitute; to form,"ประกอบเป็น, ก่อให้เกิด",6,5,"ประกอบเป็น, ก่อให้เกิด",
梅花,méi huā,plum blossom; clubs ♣,ดอกเหมย (บ๊วย),6,6,ดอกเหมย (บ๊วย); ดอกจิก (ไพ่),Added the distinct card-suit sense the EN lists (clubs).
模糊,mó hú,vague; indistinct,"พร่ามัว, คลุมเครือ",6,5,"พร่ามัว, คลุมเครือ",
正好,zhèng hǎo,just; just right,"พอดี, เหมาะเจาะ",6,4,"พอดี, เหมาะเจาะ",
正是,zhèng shì,is precisely,"คือ...นี่แหละ, เป็นเช่นนั้นพอดี",6,4,"คือ...นี่แหละ, เป็นเช่นนั้นพอดี",
治疗,zhì liáo,to treat; medical treatment,รักษา (โรค),6,5,รักษา (โรค),
治病,zhì bìng,to treat an illness,รักษาโรค,6,5,รักษาโรค,
法,fǎ,law; method,กฎหมาย; วิธี; (ย่อ) ฝรั่งเศส,6,4,กฎหมาย; วิธี,"Trimmed third sense (ย่อ ฝรั่งเศส / France abbrev), out of the law;method gloss."
法官,fǎ guān,judge,ผู้พิพากษา,6,5,ผู้พิพากษา,
洗衣机,xǐ yī jī,washing machine; washer,เครื่องซักผ้า,6,4,เครื่องซักผ้า,
流利,liú lì,fluent,คล่องแคล่ว,6,4,คล่องแคล่ว,
浇,jiāo,to pour liquid; to irrigate,"ราดน้ำ, รดน้ำ",6,5,"ราดน้ำ, รดน้ำ",
消费者,xiāo fèi zhě,consumer,ผู้บริโภค,6,5,ผู้บริโภค,
深刻,shēn kè,profound; deep,ลึกซึ้ง,6,5,ลึกซึ้ง,
漫画,màn huà,caricature; cartoon,"การ์ตูน, ลายเส้น",6,6,การ์ตูน; ภาพล้อ,Replaced ลายเส้น (linework) with ภาพล้อ (caricature) to match the EN 'caricature; cartoon'.
激发,jī fā,to arouse; to stimulate,"กระตุ้น, ปลุกให้ตื่น",6,5,"กระตุ้น, ปลุกให้ตื่น",
灵敏,líng mǐn,smart; clever,"ว่องไว, ไว",6,6,"ว่องไว, ไว","EN-GLOSS-BUG: 灵敏 = sensitive/responsive/agile (ว่องไว/ไว), not 'smart; clever' (that's 聪明). Thai follows the real sense."
热心,rè xīn,enthusiastic; ardent,"กระตือรือร้น, ใจดี",6,5,"กระตือรือร้น, มีน้ำใจ",热心 carries a warm-hearted/eager-to-help nuance; มีน้ำใจ fits better than ใจดี.
热爱,rè ài,to love ardently; to adore,รักอย่างแรงกล้า,6,5,รักอย่างแรงกล้า,
燃烧,rán shāo,to ignite; to combust,"เผาไหม้, ลุกไหม้",6,6,"เผาไหม้, ลุกไหม้",
爸,bà,father; dad,พ่อ,6,3,พ่อ,
独,dú,alone; independent,"ลำพัง, เป็นอิสระ",6,6,"ลำพัง, เป็นอิสระ",
独特,dú tè,unique; distinctive,"มีเอกลักษณ์, โดดเด่นเฉพาะตัว",6,5,"มีเอกลักษณ์, โดดเด่นเฉพาะตัว",
玉米,yù mǐ,corn; maize,ข้าวโพด,6,5,ข้าวโพด,
现代,xiàn dài,modern; contemporary,ทันสมัย; สมัยใหม่,6,4,ทันสมัย; สมัยใหม่,
理,lǐ,reason; to manage,เหตุผล; จัดการ; ลายเนื้อ(ไม้),6,4,เหตุผล; จัดการ,"Trimmed third sense ลายเนื้อไม้ (wood grain), out of the reason;manage gloss."
瓶子,píng zi,bottle,ขวด,6,4,ขวด,
生理,shēng lǐ,physiology,สรีรวิทยา,6,6,สรีรวิทยา,
用于,yòng yú,to use in; to use on,ใช้สำหรับ,6,5,ใช้สำหรับ,
用力,yòng lì,to exert oneself physically,ออกแรง,6,4,ออกแรง,
电,diàn,electricity,ไฟฟ้า,6,2,ไฟฟ้า,
留,liú,to leave; to retain,"เก็บไว้, ทิ้งไว้",6,4,"เก็บไว้, ทิ้งไว้",
疲劳,pí láo,fatigue; wearily,"เหนื่อยล้า, อ่อนเพลีย",6,5,"เหนื่อยล้า, อ่อนเพลีย",
疼,téng,it hurts; sore,"เจ็บ, ปวด",6,3,"เจ็บ, ปวด",
疼痛,téng tòng,pain; of a body part to be painful,"ปวด, เจ็บ",6,6,"ปวด, เจ็บ",
病毒,bìng dú,virus,ไวรัส,6,5,ไวรัส,
白,bái,white; in vain,"สีขาว; เปล่าๆ, ฟรี",6,2,"สีขาว; เปล่าๆ, ฟรี",
眼前,yǎn qián,before one's eyes; now,ตรงหน้า; ขณะนี้,6,4,ตรงหน้า; ขณะนี้,
着急,zháo jí,to worry; to feel anxious,"ร้อนใจ, กังวล, รีบร้อน",6,3,"ร้อนใจ, กังวล, รีบร้อน",
矛盾,máo dùn,contradiction; conflicting views,ความขัดแย้ง; ขัดแย้งกัน,6,5,ความขัดแย้ง; ขัดแย้งกัน,
短,duǎn,short; brief,สั้น,6,3,สั้น,
破坏,pò huài,destruction; damage,ทำลาย; การทำลาย,6,5,ทำลาย; การทำลาย,
硬盘,yìng pán,hard disk,ฮาร์ดดิสก์,6,5,ฮาร์ดดิสก์,
确定,què dìng,definite; certain,"กำหนดแน่นอน, ยืนยัน; แน่ใจ",6,5,"กำหนดแน่นอน, ยืนยัน; แน่ใจ",
碎,suì,broken; to break into pieces,"แตกสลาย, ชิ้นส่วน",6,5,"แตก, แตกละเอียด","Replaced ชิ้นส่วน (=parts, a noun) with แตกละเอียด; 碎 = shattered/smashed to bits."
种植,zhòng zhí,to plant; to grow,"ปลูก, เพาะปลูก",6,5,"ปลูก, เพาะปลูก",
科技,kē jì,science and technology,วิทยาศาสตร์และเทคโนโลยี,6,4,วิทยาศาสตร์และเทคโนโลยี,
稍微,shāo wēi,a little bit,"เล็กน้อย, นิดหน่อย",6,4,"เล็กน้อย, นิดหน่อย",
立,lì,to stand; to establish,"ยืน, ตั้ง",6,6,"ยืน, ตั้ง",
笨,bèn,stupid; foolish,"โง่, เซ่อ",6,4,"โง่, เซ่อ",
策略,cè lüè,strategy; tactics,"ยุทธศาสตร์, กลวิธี",6,6,"ยุทธศาสตร์, กลวิธี",
米饭,mǐ fàn,cooked rice,ข้าวสวย,6,1,ข้าวสวย,
粮食,liáng shí,foodstuff; cereals,"ธัญพืช, เสบียงอาหาร",6,5,"ธัญพืช, เสบียงอาหาร",
精美,jīng měi,exquisite; elegant,ประณีตงดงาม,6,5,ประณีตงดงาม,
精通,jīng tōng,to be proficient in; to master,"เชี่ยวชาญ, ชำนาญ",6,6,"เชี่ยวชาญ, ชำนาญ",
素,sù,plain; element,เรียบง่าย; ธาตุ,6,6,เรียบง่าย; ธาตุ,
素质,sù zhì,inner quality; basic essence,"คุณภาพ, ธรรมชาติ",6,5,"คุณภาพ, คุณสมบัติ",ธรรมชาติ (nature) imprecise; 素质 = quality/caliber of a person (คุณภาพ/คุณสมบัติ).
绝望,jué wàng,to despair; to give up all hope,สิ้นหวัง,6,5,สิ้นหวัง,
统一,tǒng yī,to unify; to integrate,"รวมเป็นหนึ่ง, รวมชาติ; เป็นเอกภาพ",6,5,"รวมเป็นหนึ่ง, รวมชาติ; เป็นเอกภาพ",
网上,wǎng shàng,online,"บนอินเทอร์เน็ต, ออนไลน์",6,3,"บนอินเทอร์เน็ต, ออนไลน์",
自动,zì dòng,automatic; voluntarily,อัตโนมัติ; โดยสมัครใจ,6,5,อัตโนมัติ; โดยสมัครใจ,
至今,zhì jīn,so far; to this day,จนถึงปัจจุบัน,6,5,จนถึงปัจจุบัน,
至少,zhì shǎo,at least; to say the least,อย่างน้อย,6,4,อย่างน้อย,
艰难,jiān nán,difficult; hard,ยากลำบาก,6,5,ยากลำบาก,
花卉,huā huì,flowers and plants,"ดอกไม้, พืชดอก",6,6,"ดอกไม้, พืชดอก",
苦,kǔ,bitter; hardship,ขม; ลำบาก,6,4,ขม; ลำบาก,
草,cǎo,grass; straw,"หญ้า, ฟาง",6,3,หญ้า; ฟาง,grass and straw are distinct referents -> '; '.
萝卜,luó bo,"radish, esp. daikon",หัวไชเท้า,6,6,หัวไชเท้า,
虚心,xū xīn,open-minded; humble,"ถ่อมตน, เปิดใจรับฟัง",6,5,"ถ่อมตน, เปิดใจรับฟัง",
虽,suī,although; even though,ถึงแม้ว่า,6,5,ถึงแม้ว่า,
血液,xuè yè,blood,เลือด,6,6,เลือด,
装修,zhuāng xiū,to decorate; interior decoration,"ตกแต่งภายใน, รีโนเวท",6,5,"ตกแต่งภายใน, รีโนเวท",
观点,guān diǎn,point of view; viewpoint,"มุมมอง, ความคิดเห็น",6,5,"มุมมอง, ความคิดเห็น",
规范,guī fàn,norm; standard,"มาตรฐาน, บรรทัดฐาน",6,6,"มาตรฐาน, บรรทัดฐาน",
解,jiě,to divide; to break up,"แตก, แยก",6,3,"แตก, แยก",
记住,jì zhù,to remember; to bear in mind,"จำไว้, จดจำ",6,3,"จำไว้, จดจำ",
记载,jì zǎi,to write down; to record,"บันทึก, จดบันทึก",6,5,"บันทึก, จดบันทึก",
评价,píng jià,to evaluate; to assess,"ประเมิน, การประเมินค่า",6,5,"ประเมิน, การประเมินค่า",
询问,xún wèn,to inquire,สอบถาม,6,5,สอบถาม,
说法,shuō fa,way of saying something; statement,"วิธีการพูด, ความเห็น",6,4,"วิธีการพูด, ความเห็น",
课,kè,subject; course,"วิชา, บทเรียน, คาบเรียน",6,2,"วิชา, บทเรียน, คาบเรียน",
象征,xiàng zhēng,symbol; emblem,"สัญลักษณ์, เป็นสัญลักษณ์ของ",6,6,"สัญลักษณ์, เป็นสัญลักษณ์ของ",
购买,gòu mǎi,to purchase; to buy,"ซื้อ, จัดซื้อ",6,4,"ซื้อ, จัดซื้อ",
资金,zī jīn,funds; capital,เงินทุน,6,5,เงินทุน,
赚钱,zhuàn qián,to earn money; moneymaking,หาเงิน,6,4,หาเงิน,
走进,zǒu jìn,to enter; to step into,เดินเข้าไป,6,5,เดินเข้าไป,
足够,zú gòu,enough; sufficient,เพียงพอ,6,5,เพียงพอ,
足迹,zú jì,footprint; track,"รอยเท้า, ร่องรอย",6,6,"รอยเท้า, ร่องรอย",
躺,tǎng,to recline; to lie down,"นอนลง, เอนตัว",6,4,"นอนลง, เอนตัว",
轻,qīng,light; easy,เบา; ง่าย,6,4,เบา; ง่าย,
过于,guò yú,excessively; too,มากเกินไป,6,5,มากเกินไป,
过来,guò lái,to come over; to manage,"เข้ามา, ผ่านมา(ทางนี้)",6,3,"เข้ามา, ผ่านมา(ทางนี้)",
运气,yùn qì,luck,โชค,6,5,โชค,
运河,yùn hé,canal,คลองขนส่ง,6,6,คลองขนส่ง,
运用,yùn yòng,to use; to put to use,"นำมาใช้, ประยุกต์ใช้",6,6,"นำมาใช้, ประยุกต์ใช้",
迷路,mí lù,to lose the way; lost,หลงทาง,6,4,หลงทาง,
退休,tuì xiū,to retire; to go into retirement,เกษียณ,6,5,เกษียณ,
逃避,táo bì,to escape; to evade,"หลบหนี, หลีกเลี่ยง",6,5,"หลบหนี, หลีกเลี่ยง",
道德,dào dé,virtue; morality,"ศีลธรรม, จริยธรรม",6,6,"ศีลธรรม, จริยธรรม",
道路,dào lù,road; path,"ถนนหนทาง, เส้นทาง",6,4,"ถนนหนทาง, เส้นทาง",
部,bù,ministry; department,"กระทรวง, แผนก",6,4,"กระทรวง, แผนก",
重,zhòng,heavy; serious,"หนัก; สำคัญ; (chóng) ซ้ำ, อีกครั้ง",6,4,หนัก; สำคัญ,"Trimmed the chóng reading (ซ้ำ/again) — a different pronunciation, out of the zhòng 'heavy; serious' gloss."
钢琴,gāng qín,piano,เปียโน,6,4,เปียโน,
阻止,zǔ zhǐ,to prevent; to block,"ขัดขวาง, ยับยั้ง",6,5,"ขัดขวาง, ยับยั้ง",
阿姨,ā yí,maternal aunt; step-mother,"ป้า, น้า(หญิง); พี่เลี้ยงเด็ก",6,3,"ป้า, น้า(หญิง); พี่เลี้ยงเด็ก","EN-GLOSS-BUG: 阿姨 = auntie / nanny-helper, not 'step-mother' (that's 继母). Thai keeps the real senses (aunt; nanny)."
非,fēi,not; non-,"ไม่ใช่, มิ",6,5,"ไม่ใช่, มิ",
鞋,xié,shoe,รองเท้า,6,3,รองเท้า,
预习,yù xí,to prepare a lesson,เตรียมบทเรียนล่วงหน้า,6,4,เตรียมบทเรียนล่วงหน้า,
餐厅,cān tīng,dining hall; dining room,"ห้องอาหาร, ภัตตาคาร",6,4,"ห้องอาหาร, ภัตตาคาร",
饼干,bǐng gān,biscuit; cracker,"ขนมปังกรอบ, คุกกี้",6,4,"ขนมปังกรอบ, คุกกี้",
高级,gāo jí,high level; high grade,"ระดับสูง, ชั้นสูง",6,4,"ระดับสูง, ชั้นสูง",
黄色,huáng sè,yellow; vulgar,สีเหลือง,6,2,สีเหลือง; ลามก,Added the distinct figurative sense the EN lists (vulgar/pornographic).
鼻子,bí zi,nose,จมูก,6,3,จมูก,
一道,yī dào,together,"ด้วยกัน, พร้อมกัน",5,5,"ด้วยกัน, พร้อมกัน",
万,wàn,ten thousand,หมื่น,5,3,หมื่น,
上次,shàng cì,last time,"คราวที่แล้ว, ครั้งก่อน",5,3,"คราวที่แล้ว, ครั้งก่อน",
上涨,shàng zhǎng,to rise; to go up,"เพิ่มขึ้น, สูงขึ้น",5,5,"เพิ่มขึ้น, สูงขึ้น",
下属,xià shǔ,subordinate; underling,ผู้ใต้บังคับบัญชา,5,6,ผู้ใต้บังคับบัญชา,
下面,xià miàn,below; under,"ข้างล่าง, ด้านล่าง",5,1,"ข้างล่าง, ด้านล่าง",
