hanzi,pinyin,english,thai_current,freq,level,thai_proposed,note
不如,bù rú,not equal to; not as good as,"สู้...ไม่ได้, ไม่เท่า",5,5,"สู้...ไม่ได้, ไม่เท่า",
不宜,bù yí,not suitable; inadvisable,"ไม่เหมาะที่จะ, ไม่ควร",5,5,"ไม่เหมาะที่จะ, ไม่ควร",
不解,bù jiě,to not understand; to be puzzled by,"ไม่เข้าใจ, งง",5,5,"ไม่เข้าใจ, งง",
不论,bù lùn,whatever; no matter what,ไม่ว่าจะ...,5,5,ไม่ว่าจะ...,
中心,zhōng xīn,center; heart,"ศูนย์กลาง, ใจกลาง",5,5,"ศูนย์กลาง, ใจกลาง",
中间,zhōng jiān,the middle; the inside,ตรงกลาง; ระหว่าง,5,3,ตรงกลาง; ระหว่าง,
临时,lín shí,as the time draws near; at the last moment,"ชั่วคราว, กะทันหัน",5,5,"ชั่วคราว, กะทันหัน",
举,jǔ,to lift; to hold up,"ยก, ชู",5,5,"ยก, ชู",
举行,jǔ xíng,to hold,"จัด(งาน/พิธี), จัดขึ้น",5,3,"จัด(งาน/พิธี), จัดขึ้น",
之外,zhī wài,outside; excluding,"นอกจาก, ภายนอก",5,4,"นอกจาก, ภายนอก",
乘客,chéng kè,passenger,ผู้โดยสาร,5,4,ผู้โดยสาร,
乙,yǐ,second in order (like grade B),ลำดับที่สอง (ในระบบสิบก้านฟ้า),5,6,ลำดับที่สอง (ในระบบสิบก้านฟ้า),
书法,shū fǎ,calligraphy; handwriting,ศิลปะตัวอักษร,5,6,ศิลปะตัวอักษร,
二氧化碳,èr yǎng huà tàn,carbon dioxide CO2,คาร์บอนไดออกไซด์,5,6,คาร์บอนไดออกไซด์,
交,jiāo,to hand over; to make friends,"ส่งมอบ, ยื่น; คบหา",5,4,"ส่งมอบ, ยื่น; คบหา",
交朋友,jiāo péng yǒu,to make friends,คบเพื่อน,5,4,คบเพื่อน,
交际,jiāo jì,communication; social intercourse,"การสื่อสาร, ความสัมพันธ์ระหว่างคน",5,5,"การสื่อสาร, ความสัมพันธ์ระหว่างคน",
